title,url,thumbnail_url,channel_name,num_views_total,hours_uploaded,description
Chapter 3 No Way Home,https://www.youtube.com/watch?v=-Y6K7F58ee0,https://i.ytimg.com/vi/-Y6K7F58ee0/hqdefault.jpg?sqp=-oaymwEcCPYBEIoBSFXyq4qpAw4IARUAAIhCGAFwAcABBg==&rs=AOn4CLDFmz2pbCoEPxmLBZ3r_YNTLheV0A,Ceeday,5.4M,1 day ago,Chapter 3 No Way Home https://www.instagram.com/ceeday98/?hl=en Please use my support a creator code: Ceedayy https://www.youtube.com/watch?v=-QxmD6ISXXU Song: RageSound - Vortex (No Copyright...
Nardwuar vs. J. Cole (2021),https://www.youtube.com/watch?v=GxVXEd_G_60,https://i.ytimg.com/vi/GxVXEd_G_60/hqdefault.jpg?sqp=-oaymwEcCPYBEIoBSFXyq4qpAw4IARUAAIhCGAFwAcABBg==&rs=AOn4CLD5jYEWslLlhZ_1si8ke9aWwJxbNA,NardwuarServiette,1.4M,1 day ago,"Nardwuar interviews J. Cole on December 9, 2021 in Santa Monica, CA USA ! Doot doo ! https://www.twitch.tv/nardwuarserviette Nardwuar Twitter: http://www.twitter.com/nardwuar Nardwuar..."
so Snoop Dogg sent me this..,https://www.youtube.com/shorts/AoDtj4uZbR4,https://i.ytimg.com/vi/AoDtj4uZbR4/hq2.jpg,Davie504,4.1M,1 day ago,#shorts
I GOT MY BOYFRIEND THE BEST CHRISTMAS PRESENT EVER!! **HELLCAT REDEYE**,https://www.youtube.com/watch?v=LQyK1pHQhqA,,GnB Vids,377K,1 day ago,"Hope you guys enjoyed the video! ❤️ Merry Christmas to everyone, we love you all so so much!! Comment down below if you guys are G or B Team! Also Subscribe if you're new! Give this video..."
THE CRAZIEST FAMILY CHRISTMAS GIFTS OPENING EVER!!,https://www.youtube.com/watch?v=NCvnC5GhSdA,,FaZe Rug,2.7M,1 day ago,"MERRY CHRISTMAS FROM MY FAMILY TO YOU! I hope you all have an amazing & blessed Christmas, and if you don't celebrate Christmas, hope you're having a great day! 🔴 SUBSCRIBE FOR LIT VIDEOS..."
James Webb Space Telescope Launch — Official NASA Broadcast,https://www.youtube.com/watch?v=7nT7JGZMbtM,,NASA,5.1M,Streamed 1 day ago,"Watch the launch of the James Webb Space Telescope—the most powerful space telescope ever made. This mission launched at 7:20 a.m. EST (12:20 UTC), Dec. 25, 2021, aboard an Ariane 5 rocket..."
Becoming a good person speedrun (13.31 seconds),https://www.youtube.com/shorts/FpEnlaGbGFU,,I am MoBo,3.1M,1 day ago,It's Christmas and you need to be good to get presents. So this is what you do. Subscribe and like for more skits #shorts All My Links: https://linktr.ee/mobowl Socials: Tiktok: https://www.tikt...
"DDG'S $100,000 CHRISTMAS GOT RUINED!! MY FAMILY STARTED FIGHTING!! (NOT CLICKBAIT)",https://www.youtube.com/watch?v=FWMo8AKbx4M,,PontiacMadeDDG VLOGS,320K,1 day ago,LOL follow me on instagram @PontiacMadeDDG
When u ask for extra cheese 😂,https://www.youtube.com/shorts/ti-EppKRtJs,,Adam W,8M,2 days ago,"Subscribe Here for new #shorts: https://www.youtube.com/channel/UC_k6... THANKS FOR WATCHING!! LIKE, COMMENT, AND SUBSCRIBE FOR MORE VIDS! --------------------------------------------------------..."
DDG - Fairly Odd Parents “Freestyle” (Official Video),https://www.youtube.com/watch?v=yGp9frozacw,,Zooted Music,318K,1 day ago,DDG - Fairly Odd Parents (Official Music Video) Follow me on Instagram: @PontiacMadeDDG Shot by @LewisYouNasty Produced By @TreOnTheBeat Yuh
The worst thing that happened on tour,https://www.youtube.com/watch?v=C5e5eJCndaE,,Emirichu,517K,1 day ago,Check out GamerSupps!: http://gamersupps.gg/discount/Emirichu?afmc=Emirichu UPDATE: all 5000 codes have been used!!! the code will now give you 10% off your purchase instead of free shipping!...
